{
  "$schema": "https://json-schema.org/draft/2020-12/schema",
  "$id": "https://slayidlerepeat.local/schema/drops.schema.json",
  "title": "drops.json",
  "description": "08 §2, §3, §3.0a, §3.1, §3.2, §6 and 24 §4.0a — rarity tables per chapter band, item stat generation, affix pool, quality range, container contents.",
  "type": "object",
  "additionalProperties": false,
  "required": ["$schema", "_doc", "_status", "rarities", "dropShareByChapterBand", "itemGeneration", "slotCoefficients", "percentStatsByRarity", "affixPool", "sets", "containerContents", "acquisitionRates"],
  "$defs": {
    "rarity": { "enum": ["C", "B", "A", "S", "SS"] },
    "slot": { "enum": ["WEAPON", "HELMET", "ARMOR", "BOOTS", "RING", "AMULET"] },
    "rarityShareMap": {
      "description": "Percentages by rarity; a band must sum to 100.",
      "type": "object",
      "additionalProperties": false,
      "minProperties": 1,
      "patternProperties": { "^(C|B|A|S|SS)$": { "type": "number", "minimum": 0, "maximum": 100 } }
    }
  },
  "properties": {
    "$schema": { "type": "string" },
    "_doc": { "type": "string", "minLength": 1 },
    "_status": { "enum": ["transcribed", "partial", "skeleton"] },
    "rarities": {
      "description": "08 §2 — the five rarities, ascending. Exactly five; ids unique.",
      "type": "array",
      "minItems": 5,
      "maxItems": 5,
      "uniqueItems": true,
      "items": {
        "type": "object",
        "additionalProperties": false,
        "required": ["id", "displayName", "statMultiplier", "affixCount"],
        "properties": {
          "id": { "$ref": "#/$defs/rarity" },
          "displayName": { "type": "string", "pattern": "^loc(\\.[a-z0-9_]+)+$" },
          "statMultiplier": { "type": "number", "minimum": 1 },
          "affixCount": { "type": "integer", "minimum": 0, "maximum": 4 }
        }
      }
    },
    "dropShareByChapterBand": {
      "description": "08 §2 — DropShare(chapter). Bands must tile chapters 1-8 without gaps or overlaps, and each share map must sum to 100. Later chapters remove C entirely and lift the S/SS shares.",
      "type": "array",
      "minItems": 1,
      "uniqueItems": true,
      "items": {
        "type": "object",
        "additionalProperties": false,
        "required": ["chapterFrom", "chapterTo", "share"],
        "properties": {
          "chapterFrom": { "type": "integer", "minimum": 1, "maximum": 8 },
          "chapterTo": { "type": "integer", "minimum": 1, "maximum": 8 },
          "share": { "$ref": "#/$defs/rarityShareMap" }
        }
      }
    },
    "itemGeneration": {
      "description": "08 §3 — ItemPower(chapter, rarity) = ChapterPowerTarget(chapter) * itemPowerCoefficient * RarityMult(rarity). Quality is one scalar q in [0,1] per item instance, displayed directly as a 0-100% bar. The ranges are deliberately asymmetric.",
      "type": "object",
      "additionalProperties": false,
      "required": ["_doc", "itemPowerCoefficient", "quality"],
      "properties": {
        "_doc": { "type": "string", "minLength": 1 },
        "itemPowerCoefficient": { "type": "number", "exclusiveMinimum": 0, "maximum": 1 },
        "quality": {
          "type": "object",
          "additionalProperties": false,
          "required": ["min", "max", "primaryScale", "secondaryScale"],
          "properties": {
            "min": { "const": 0.0 },
            "max": { "const": 1.0 },
            "primaryScale": {
              "type": "object",
              "additionalProperties": false,
              "required": ["base", "span"],
              "properties": {
                "base": { "type": "number", "exclusiveMinimum": 0 },
                "span": { "type": "number", "exclusiveMinimum": 0 }
              }
            },
            "secondaryScale": { "$ref": "#/properties/itemGeneration/properties/quality/properties/primaryScale" }
          }
        }
      }
    },
    "slotCoefficients": {
      "description": "08 §3.0a — one row per equipment slot. Flat stats scale with ItemPower and therefore with chapter; percent stats scale with rarity only and carry a null coefficient here, meaning 'read percentStatsByRarity instead'. 08 §3.0a warns that the flat coefficients are expected to move under assertion A13.",
      "type": "array",
      "minItems": 6,
      "maxItems": 6,
      "uniqueItems": true,
      "items": {
        "type": "object",
        "additionalProperties": false,
        "required": ["slot", "primaryStat", "primaryCoef", "secondaryStat", "secondaryCoef"],
        "properties": {
          "slot": { "$ref": "#/$defs/slot" },
          "primaryStat": { "type": "string", "pattern": "^[A-Z][A-Z0-9_]*$" },
          "primaryCoef": { "type": ["number", "null"], "exclusiveMinimum": 0 },
          "secondaryStat": { "type": "string", "pattern": "^[A-Z][A-Z0-9_]*$" },
          "secondaryCoef": { "type": ["number", "null"], "exclusiveMinimum": 0 }
        }
      }
    },
    "percentStatsByRarity": {
      "description": "08 §3.0a — percent stats scale with rarity only, never with chapter, because they feed capped percentages (05 §1.1) and must not inflate across chapters. Values are fractions, not percentages.",
      "type": "object",
      "required": ["_doc"],
      "additionalProperties": false,
      "properties": { "_doc": { "type": "string", "minLength": 1 } },
      "patternProperties": {
        "^(CRIT|ASPD|DODGE|PEN|LIFESTEAL|BLOCK|DR)$": {
          "type": "object",
          "additionalProperties": false,
          "required": ["C", "B", "A", "S", "SS"],
          "patternProperties": { "^(C|B|A|S|SS)$": { "type": "number", "minimum": 0, "maximum": 1 } }
        }
      }
    },
    "affixPool": {
      "description": "08 §3.1 — 13 affixes, slot-restricted, rolled by rarity B and above. ⚠️ Thirteen, not the document's fourteen: AFX_REROLL_CHARGE is gone with the reroll charge it granted, so RING and AMULET each have one fewer eligible affix. Three ids are authored in the design docs (AFX_CRIT_CHANCE, AFX_CRIT_DAMAGE, AFX_PEN); M4-03 derived the rest from the same AFX_<STAT> convention under a kickoff ruling, so the id is now required rather than nullable — a row that loses its id can no longer be rolled, and the schema says so instead of the reader discovering it.",
      "type": "object",
      "additionalProperties": false,
      "required": ["_doc", "affixes"],
      "properties": {
        "_doc": { "type": "string", "minLength": 1 },
        "affixes": {
          "type": "array",
          "minItems": 13,
          "maxItems": 13,
          "uniqueItems": true,
          "items": {
            "type": "object",
            "additionalProperties": false,
            "required": ["id", "displayName", "stat", "op", "min", "max", "slots"],
            "properties": {
              "id": { "type": "string", "pattern": "^AFX_[A-Z0-9_]+$" },
              "displayName": { "type": "string", "pattern": "^loc(\\.[a-z0-9_]+)+$" },
              "stat": {
                "description": "The stat this affix writes, spelled as one StatId name. null where the design authors an affix the 14-stat block has no slot for, which is AFX_DAMAGE_VS_ELITES alone: conditional damage has no stat, and a target-conditional standing effect cannot be re-aggregated outside an attack. Required rather than optional, so an affix cannot lose its stat and quietly stop contributing.",
                "type": ["string", "null"],
                "pattern": "^[A-Z][A-Z0-9_]*$"
              },
              "op": {
                "description": "How the affix writes it. Two ops rather than the whole effect vocabulary, deliberately: an affix is a standing stat modifier and nothing else, so an authoring slip cannot turn one into a summon. STAT_ADD_FLAT adds X percentage points and is what a stat that is itself a fraction or an accumulator takes; STAT_ADD_PCT multiplies and is only correct for a stat whose base is a magnitude the percentage is taken of, because aggregation multiplies the running value and a percent of a zero base is zero. null exactly where stat is null.",
                "enum": ["STAT_ADD_FLAT", "STAT_ADD_PCT", null]
              },
              "min": { "description": "Signed since 16 D46: AFX_DAMAGE_REDUCTION adds flat onto DR_PCT's base 1.0 (a damage-taken multiplier), so its range is negative. DropsTuning still refuses max < min and non-finite bounds.", "type": "number" },
              "max": { "type": "number" },
              "slots": { "type": "array", "minItems": 1, "uniqueItems": true, "items": { "$ref": "#/$defs/slot" } },
              "minRarity": { "$ref": "#/$defs/rarity" }
            }
          }
        }
      }
    },
    "sets": {
      "description": "08 §3.2 — exactly 4 sets, one per family axis, SS only. 4 sets x 6 slots = 24 SS items. The design docs give set names but no setId vocabulary.",
      "type": "object",
      "additionalProperties": false,
      "required": ["_doc", "breakpoints", "sets"],
      "properties": {
        "_doc": { "type": "string", "minLength": 1 },
        "breakpoints": { "type": "array", "minItems": 1, "uniqueItems": true, "items": { "type": "integer", "minimum": 1, "maximum": 6 } },
        "sets": {
          "type": "array",
          "minItems": 4,
          "maxItems": 4,
          "uniqueItems": true,
          "items": {
            "type": "object",
            "additionalProperties": false,
            "required": ["id", "displayName", "familyAxis"],
            "properties": {
              "id": { "type": ["string", "null"], "pattern": "^SET_[A-Z0-9_]+$" },
              "displayName": { "type": "string", "pattern": "^loc(\\.[a-z0-9_]+)+$" },
              "familyAxis": { "enum": ["BALANCED", "HEAVY", "CASTER", "AGILE"] }
            }
          }
        }
      }
    },
    "containerContents": {
      "description": "24 §4.0a — what a container yields per open. chapterOrigin = max(1, highestChapterCleared), read at open time. CHEST_STANDARD's table is a function of dropShareByChapterBand, not a literal.",
      "type": "object",
      "additionalProperties": false,
      "required": ["_doc", "CHEST_STANDARD", "CHEST_PREMIUM", "CHEST_APEX"],
      "properties": {
        "_doc": { "type": "string", "minLength": 1 }
      },
      "patternProperties": {
        "^CHEST_[A-Z0-9_]+$": {
          "type": "object",
          "additionalProperties": false,
          "required": ["itemsPerOpen", "rarityTable", "baseSsWeight"],
          "properties": {
            "itemsPerOpen": { "type": "integer", "exclusiveMinimum": 0 },
            "rarityTable": { "oneOf": [{ "$ref": "#/$defs/rarityShareMap" }, { "type": "null" }] },
            "rarityTableSource": {
              "description": "Set when rarityTable is null because the table is derived rather than literal. Names the field it is derived from.",
              "type": "string",
              "minLength": 1
            },
            "baseSsWeight": { "type": ["number", "null"], "minimum": 0 }
          }
        }
      }
    },
    "acquisitionRates": {
      "description": "08 §6 — how gear reaches the player. Design target: 20-35 items per hour of play, of which 2-5 are meaningful upgrades or merge fodder.",
      "type": "object",
      "additionalProperties": false,
      "required": ["_doc", "eliteKillItems", "bossKillItemsMin", "bossKillItemsMax", "normalEnemyChance", "treasureTileChance"],
      "properties": {
        "_doc": { "type": "string", "minLength": 1 },
        "eliteKillItems": { "type": "integer", "minimum": 0 },
        "bossKillItemsMin": {
          "description": "17 §10 — the Gear drops column of the boss reward table, at its floor: chapters 1-3 pay '2 items'. 📐 Authored once, here, rather than per boss — content/bosses/ carries a boss's identity and mechanics, and its payout is economy.",
          "type": "integer", "minimum": 0
        },
        "bossKillItemsMax": {
          "description": "17 §10 — the same column at its ceiling: chapters 4-8 pay '3 items'. The rarity cap that column also states (B-, A-, S-, SS-capped by chapter) is the drop table's rarity band, not a count, and is not authored on this pair.",
          "type": "integer", "minimum": 0
        },
        "normalEnemyChance": { "type": "number", "minimum": 0, "maximum": 1 },
        "treasureTileChance": { "type": ["number", "null"], "minimum": 0, "maximum": 1 }
      }
    }
  }
}
