{
  "$schema": "../schema/drops.schema.json",
  "_doc": "08 §2, §3, §3.0a, §3.1, §3.2, §6 (rarity tables per chapter band, item stat generation, affix pool, quality range) and 24 §4.0a (container contents). 08 §3.0a: expect the flat slot coefficients to move — assertion A13 (29 §5.1 P2, gear <= 60% of the power multiplier) is what validates them.",
  "_status": "partial",
  "rarities": [
    { "id": "C", "displayName": "loc.rarity.c.name", "statMultiplier": 1.0, "affixCount": 0 },
    { "id": "B", "displayName": "loc.rarity.b.name", "statMultiplier": 1.55, "affixCount": 1 },
    { "id": "A", "displayName": "loc.rarity.a.name", "statMultiplier": 2.4, "affixCount": 2 },
    { "id": "S", "displayName": "loc.rarity.s.name", "statMultiplier": 3.8, "affixCount": 3 },
    { "id": "SS", "displayName": "loc.rarity.ss.name", "statMultiplier": 6.0, "affixCount": 4 }
  ],
  "dropShareByChapterBand": [
    { "chapterFrom": 1, "chapterTo": 2, "share": { "C": 60, "B": 27, "A": 10, "S": 2.7, "SS": 0.3 } },
    { "chapterFrom": 3, "chapterTo": 4, "share": { "C": 40, "B": 36, "A": 18, "S": 5.4, "SS": 0.6 } },
    { "chapterFrom": 5, "chapterTo": 6, "share": { "C": 15, "B": 40, "A": 32, "S": 11, "SS": 2 } },
    { "chapterFrom": 7, "chapterTo": 8, "share": { "C": 0, "B": 28, "A": 44, "S": 23, "SS": 5 } }
  ],
  "itemGeneration": {
    "_doc": "08 §3 — ItemPower(chapter, rarity) = ChapterPowerTarget(chapter) * itemPowerCoefficient * RarityMult(rarity). ChapterPowerTarget lives in par_power.json.",
    "itemPowerCoefficient": 0.1,
    "quality": {
      "min": 0.0,
      "max": 1.0,
      "primaryScale": { "base": 0.9, "span": 0.2 },
      "secondaryScale": { "base": 0.85, "span": 0.3 }
    }
  },
  "slotCoefficients": [
    { "slot": "WEAPON", "primaryStat": "ATK", "primaryCoef": 0.2, "secondaryStat": "CRIT", "secondaryCoef": null },
    { "slot": "HELMET", "primaryStat": "DEF", "primaryCoef": 0.18, "secondaryStat": "MAX_HP", "secondaryCoef": 0.55 },
    { "slot": "ARMOR", "primaryStat": "MAX_HP", "primaryCoef": 1.1, "secondaryStat": "DEF", "secondaryCoef": 0.12 },
    { "slot": "BOOTS", "primaryStat": "ASPD", "primaryCoef": null, "secondaryStat": "DODGE", "secondaryCoef": null },
    { "slot": "RING", "primaryStat": "CRIT", "primaryCoef": null, "secondaryStat": "PEN", "secondaryCoef": null },
    { "slot": "AMULET", "primaryStat": "MAX_HP", "primaryCoef": 0.45, "secondaryStat": "LIFESTEAL", "secondaryCoef": null }
  ],
  "percentStatsByRarity": {
    "_doc": "08 §3.0a — percent stats scale with rarity only, never with chapter, because they feed capped percentages (05 §1.1). A null coefficient in slotCoefficients means 'read this table instead'.",
    "CRIT": { "C": 0.015, "B": 0.025, "A": 0.04, "S": 0.06, "SS": 0.08 },
    "ASPD": { "C": 0.02, "B": 0.03, "A": 0.045, "S": 0.07, "SS": 0.1 },
    "DODGE": { "C": 0.01, "B": 0.015, "A": 0.025, "S": 0.04, "SS": 0.055 },
    "PEN": { "C": 0.02, "B": 0.035, "A": 0.05, "S": 0.08, "SS": 0.11 },
    "LIFESTEAL": { "C": 0.015, "B": 0.025, "A": 0.04, "S": 0.06, "SS": 0.08 }
  },
  "affixPool": {
    "_doc": "08 §3.1 — 13 affixes, slot-restricted, rolled by rarity B and above. ⚠️ Thirteen, not the fourteen the document authors: AFX_REROLL_CHARGE is gone with the reroll charge it granted, and nothing was authored in its place, so RING and AMULET each have one fewer eligible affix. AFX_CRIT_CHANCE, AFX_CRIT_DAMAGE and AFX_PEN are AUTHORED (08 §7, 19 D5); the remaining 11 ids are DERIVED by M4-03 from that same AFX_<STAT> convention, matching each row's own displayName stem — an identifier decision, ruled at the M4 kickoff, not an invented number. Every range below stays exactly as the design set authors it. Each row also names the stat it writes and the op it writes with. The op is NOT uniform and that is load-bearing: stat aggregation is Final = (Base + sum of flat) * (1 + sum of percent), and the hero base for LIFESTEAL, BLOCK, PEN, DR_PCT, DMG_PCT and THORNS is 0.0 - so a percent add onto one of them is arithmetically inert. A '+X%' affix on a stat that IS a fraction (crit chance, crit damage, penetration, dodge, block, lifesteal, damage reduction) is therefore X percentage points, STAT_ADD_FLAT; only the magnitude stats a percentage is naturally taken OF - MAX_HP, DEF, ASPD - take STAT_ADD_PCT. The two non-combat stats (GOLD_PCT, PET_AURA_PCT) are accumulators with no base at all and take STAT_ADD_FLAT for the same reason. AFX_DAMAGE_VS_ELITES names no stat and no op: it is conditional damage, the 14-stat block has no conditional bucket, and a target-conditional standing effect throws during re-aggregation because that context carries no target. Left null rather than forced.",
    "affixes": [
      { "id": "AFX_CRIT_CHANCE", "displayName": "loc.affix.crit_chance.name", "stat": "CRIT", "op": "STAT_ADD_FLAT", "min": 0.02, "max": 0.08, "slots": ["WEAPON", "RING", "HELMET"] },
      { "id": "AFX_CRIT_DAMAGE", "displayName": "loc.affix.crit_damage.name", "stat": "CDMG", "op": "STAT_ADD_FLAT", "min": 0.1, "max": 0.35, "slots": ["WEAPON", "RING"] },
      { "id": "AFX_ATTACK_SPEED", "displayName": "loc.affix.attack_speed.name", "stat": "ASPD", "op": "STAT_ADD_PCT", "min": 0.03, "max": 0.12, "slots": ["WEAPON", "BOOTS"] },
      { "id": "AFX_PEN", "displayName": "loc.affix.pen.name", "stat": "PEN", "op": "STAT_ADD_FLAT", "min": 0.04, "max": 0.15, "slots": ["WEAPON", "RING"] },
      { "id": "AFX_MAX_HP", "displayName": "loc.affix.max_hp.name", "stat": "MAX_HP", "op": "STAT_ADD_PCT", "min": 0.05, "max": 0.2, "slots": ["ARMOR", "HELMET", "AMULET"] },
      { "id": "AFX_DEF", "displayName": "loc.affix.def.name", "stat": "DEF", "op": "STAT_ADD_PCT", "min": 0.05, "max": 0.22, "slots": ["ARMOR", "HELMET", "BOOTS"] },
      { "id": "AFX_DODGE", "displayName": "loc.affix.dodge.name", "stat": "DODGE", "op": "STAT_ADD_FLAT", "min": 0.02, "max": 0.08, "slots": ["BOOTS", "AMULET"] },
      { "id": "AFX_BLOCK", "displayName": "loc.affix.block.name", "stat": "BLOCK", "op": "STAT_ADD_FLAT", "min": 0.03, "max": 0.12, "slots": ["ARMOR", "HELMET"] },
      { "id": "AFX_LIFESTEAL", "displayName": "loc.affix.lifesteal.name", "stat": "LIFESTEAL", "op": "STAT_ADD_FLAT", "min": 0.02, "max": 0.09, "slots": ["AMULET", "WEAPON"] },
      { "id": "AFX_DAMAGE_REDUCTION", "displayName": "loc.affix.damage_reduction.name", "stat": "DR_PCT", "op": "STAT_ADD_FLAT", "min": 0.02, "max": 0.08, "slots": ["ARMOR", "AMULET"] },
      { "id": "AFX_GOLD_GAIN", "displayName": "loc.affix.gold_gain.name", "stat": "GOLD_PCT", "op": "STAT_ADD_FLAT", "min": 0.08, "max": 0.3, "slots": ["RING", "AMULET"] },
      { "id": "AFX_PET_AURA_POWER", "displayName": "loc.affix.pet_aura_power.name", "stat": "PET_AURA_PCT", "op": "STAT_ADD_FLAT", "min": 0.05, "max": 0.2, "slots": ["AMULET", "RING"] },
      { "id": "AFX_DAMAGE_VS_ELITES", "displayName": "loc.affix.damage_vs_elites.name", "stat": null, "op": null, "min": 0.08, "max": 0.25, "slots": ["WEAPON", "RING"] }
    ]
  },
  "sets": {
    "_doc": "08 §3.2 — exactly 4 sets, one per family axis, SS only. The design docs give set names but no setId vocabulary (08 §7 shows setId: null), so id is left unauthored.",
    "breakpoints": [2, 4, 6],
    "sets": [
      { "id": null, "displayName": "loc.set.bloodmoon.name", "familyAxis": "BALANCED" },
      { "id": null, "displayName": "loc.set.ironvow.name", "familyAxis": "HEAVY" },
      { "id": null, "displayName": "loc.set.fateweave.name", "familyAxis": "CASTER" },
      { "id": null, "displayName": "loc.set.stormcall.name", "familyAxis": "AGILE" }
    ]
  },
  "containerContents": {
    "_doc": "24 §4.0a — chapterOrigin = max(1, highestChapterCleared), read at open time. CHEST_STANDARD's table is a function of DropShare(chapterOrigin) above, not a literal; CHEST_APEX has no soft pity and therefore no baseSsWeight.",
    "CHEST_STANDARD": { "itemsPerOpen": 1, "rarityTable": null, "rarityTableSource": "dropShareByChapterBand", "baseSsWeight": null },
    "CHEST_PREMIUM": { "itemsPerOpen": 2, "rarityTable": { "B": 20, "A": 45, "S": 30, "SS": 5 }, "baseSsWeight": 5 },
    "CHEST_APEX": { "itemsPerOpen": 2, "rarityTable": { "S": 50, "SS": 50 }, "baseSsWeight": null }
  },
  "acquisitionRates": {
    "_doc": "08 §6. CONFLICT: 08 §6 lists a 25% treasure-tile gear chance, but 03 §7a.3 (the later single-source-of-truth ruling for in-run payouts) states treasure tiles never drop gear in v1. treasureTileChance is therefore left unauthored pending a doc fix.",
    "eliteKillItems": 1,
    "bossKillItemsMin": 2,
    "bossKillItemsMax": 3,
    "normalEnemyChance": 0.08,
    "treasureTileChance": null
  }
}
